{
  "$schema": "https://unpkg.com/skills-package-manager@0.10.0/skills.schema.json",
  "installDir": ".agents/skills",
  "linkTargets": [".claude/skills"],
  "selfSkill": false,
  "skills": {
    "skills-package-manager-cli": "link:./packages/skills-package-manager/skills/skills-package-manager-cli"
  }
}
